Book title,Author,Description
Frontend Web Development Bootcamp - Build a Twitter Clo...,By George Lomidze,"Master frontend web development using HTML, CSS, CSS Flexbox, CSS Grid, and JavaScript"
A Frontend Web Developer s Guide to Testing,By Eran Kinsbruner,Discover expert tips and best practices for maximizing the efficacy of various test automation frameworks and gain ...
Svelte 3 Up and Running,By Alessandro Segala,Build your first web project using the Svelte framework and deploy it in the cloud with automated testing and CI/CD
Front-End Development Projects with Vue.js,By Clifford Gurney...,Get to grips with the core fundamentals of Vue.js 2 and learn to build reliable component-based applications with p...
Bootstrap 4 From Scratch With 5 Projects,By Brad Traversy,Master the latest version of Bootstrap (4.0.0 Beta) and build 5 real-world themes while learning HTML5 semantics &a...
ASP.NET Core 5 and React,By Carl Rippon,"Build fully functional, cloud-ready, and professional web applications using the latest features in the .NET 5 fram..."
"Front-End Web Development with Modern HTML, CSS, and Ja...",By Laurence Lars Svekis,"Learn all the core fundamentals of modern web design, covering all the commonly used syntax for HTML and CSS."
React and React Native,By Adam Boduch...,"Fourth Edition of the popular React book, updated to the latest React 18 to help you go from beginner to profession..."
Learning Angular,By Pablo Deeleman...,Build your first production-grade web applications from scratch with Angular with the help of expert guidance and s...
React 18 Design Patterns and Best Practices,By Carlos Santana Rold n,Dive in and discover how to build awesome React web apps that you can scale and maintain using design patterns and ...
Web Development with Blazor,By Jimmy Engstr m,Develop modern web UIs with Blazor Server and Blazor WebAssembly Purchase of the print or Kindle book includes a fr...
React Application Architecture for Production,By Alan Alickovic,A hands-on guide to help you develop skills and confidence in building and structuring React applications in a well...
