author,date,description,tags,title
Riya,July 2021,"What is a web scraping and why should you learn how to do it?, ,I will talk about what it means to scrape data from the web and what is wrong with go-to copy-paste techniques. This will also cover various benefits of web-scraping, not only for work, but also how it can help to make your life simpler: using it for job-searching, product price monitoring, and collecting data to train ML models., ,This talk will first cover the basics like using CSS Selectors for parsing data., ,I will cover how to use developer tools to look for a tag, class, or id to target the required data., ,I will also go through some basics of Regex which can be very useful in targeting required data., ,After building up the base for web-scraping, I’ll show you some of the major tools including requests, BeautifulSoup, Selenium, Scrapy in an interactive manner, where you can follow along, as we build up from the most user-friendly tools like requests and BeautifulSoup to more specialized tools.,We’ll go a step further in this process and take a brief look at more complex topics. I  will cover the problems that you will come across while scraping, such as asynchronous loading and client-side rendering, authentication, redirects, captchas, etc, and their possible workarounds. Finally, I’ll show how to automate web-scraping tasks using cron (Linux) and Task Scheduler (Windows)., ,You’ll leave the talk with a good understanding of the techniques of web scraping, and a library of useful tools you can use to write your own scrapers.","Command-Line,HTML5,Linux,Python 3,Web Crawling",Improved web scraping with Python tools and Bash utilities.
Marcin Wojnarski,July 2021,"HYPERTAG (,) is a full-featured standalone language for HTML templating and document generation. Inspired by indentation-based template languages (Slim, Haml, Shpaml, Pug), it provides clean, readable syntax and multiple original features that enhance code reuse and modularity: native custom tags, DOM manipulation, Python-like granular imports, control blocks, compound expressions, and more.","Clean Code,Django,Templating,Web,Web General",Hypertag: an Indented Language for easy HTML Generation & Web Templating
Joost Lek,July 2021,"Open source code is the foundation for a lot of my own work, but of course also the work of others. And the beauty of open source is you never know where your contributions end up. This story begins in the summer of 2019 when I wanted to see if I could contribute to the python project I’ve been using so much. In this talk I’ll walk you through the challenges I faced making my first contribution to cpython, picking a bug and squashing it. I’ll end the talk explaining the title: after viewing the 2020  mars helicopter fly on the red planet I realized I have a new badge on my github page. I never started out thinking I could have my code flying in space, let alone flying on mars. But it does. I hope to inspire others to step over the hurdle and contribute back to the open source tools they use.","Development,Open-Source,python",How I helped fly a helicopter on Mars
"Chiin-Rui Tan,Sara Nunnington",July 2021,"In the ultra-competitive sporting world, the value of data and computing has been on the rise. When the difference between winning and losing, success and failure hinges on the smallest of margins, being able to calculate and implement optimal, timely decisions is literally game-changing, and potentially life-changing.","Computer Vision,Data Science,Machine-Learning,Scientific Libraries (Numpy/Pandas/SciKit/...),Visualization",How Scientific Computing is advancing the world of Football
Mar Bartolome,July 2021,"It's no secret that the hardest problems in computer science are cache invalidation and naming things... oh, and hiring.","Diversity,Job Hunting,Management,Workforce",Hiring Demystified
Harshit Prasad,July 2021,"In the current technology era, all kind of applications work on data. Data is used to represent a set of information. The healthcare apps, e-commerce apps etc works on data. Sometimes, this data needs to be get updated to reflect new changes across the platform. This action can be performed manually but what if platform data is getting updated in realtime or let’s say in every 1 hour? Such kind of problem can be solved by implementing a service based on Producer Consumer model.","E-Commerce,Elastic Search,Engineering,EuroPython,Messaging and Job Queues (RabbitMQ/Redis/...)","High Performance Data Processing with Python, Kafka and Elasticsearch"
Paolo Melchiorre,July 2021,"Every time we’re going to create a new project with Django we make assessments on its requirements to choose the best architecture, of which, the database is usually the core.","Best Practice,Databases,Django,PostgreSQL",Django with PostgreSQL superpowers
"Maria Jose Molina-Contreras, PhD",July 2021,"For many years, people have been filling their home with devices that are based on Microcontrollers, like virtual assistants, smart fridges, washing machines, security systems, and many others that can be either programmable, or even replicated with a couple of boards and our Python knowledge.,During this talk, we will start exploring CircuitPython without the need of a physical device, using a microcontroller emulator.  If you are new to the microcontroller world, don’t worry, we will have an introduction to the main concepts, so we have the base knowledge to start doing little experiments by ourselves.,After the introduction, you will be able to start programming microcontrollers using the emulator or in real life, moreover, you will see a couple of real projects (with real devices!) that could easily be replicated by yourself: a low-cost robot floor cleaner, and a plant watering and monitoring system, as examples.","DIY,Hardware/IoT",DIY Home Automation with Microcontrollers and CircuitPython
Abby Carey,July 2021,"Learn how to build Flask apps for Cloud Run, one of Google Cloud's serverless platforms. To accelerate the Cloud Run development loop, we'll be using Cloud Code, an IDE plugin that makes working with Cloud Run easy. We'll also cover how to integrate products like Cloud SQL, Pub/Sub, and Secret Manager.","Public Cloud,Web Servers and MicroFWs (Flask/Tornado/Nginx/...),python",Developing Flask Applications for Google Cloud
Eduardo Blancas,July 2021,** Description **,"Best Practice,Data Science,Deployment/Continuous Integration and Delivery,Machine-Learning,Scientific Libraries (Numpy/Pandas/SciKit/...)",Develop and deploy a Machine Learning pipeline in 30 minutes with Ploomber
Roberto Polli,July 2021,## Goal,"APIs,Case Study",Designing secure APIs
Chin Hwee Ong,July 2021,"When building data pipelines at scale, it is crucial to design data pipelines that are reliable, scalable and extensible according to evolving business needs. Designing data pipelines for reproducibility and maintainability is a challenge, as testing and debugging across compute units (threads/cores/computes) are often complex and time-consuming due to dependencies and shared states at runtime. In this talk, Chin Hwee will be sharing about common challenges in designing reproducible and maintainable data pipelines at scale, and exploring the use of functional programming in Python to build scalable production-ready data pipelines that are designed for reproducibility and maintainability. Through analogies and realistic examples inspired by data pipeline designs in production environments, you will learn about:","Data,Functional Programming,Python 3",Designing Functional Data Pipelines for Reproducibility and Maintainability
Bojan Miletic,July 2021,"While dependency injections is widely used in other programming languages, it's a design pattern that is nowhere near as popular in Python. During this talk I would like to introduce you to this concept and show you how it can improve your engineering skills.","Architecture,Best Practice,Python general,Software Design",Dependency Injection: Stealing Cool stuff from the Weird Kids
Prakshi Yadav,July 2021,"Designing a data lake necessitates well-researched storage, management, scalability, and availability solutions. However, managing schema evolution remains a difficult task. The structure of data differs from one company to the next, making it difficult to generalize a solution to the schema evolution problem.","Architecture,Best Practice,Big Data,Data,Public Cloud",Data lake: Design for schema evolution
"Gael Grosch,Francesco Lässig",July 2021,"Time series are everywhere in science and business, and the ability to forecast them accurately and efficiently can provide decisive advantages. For much of its history, time series forecasting has mostly been relying on ""classical"" statistical methods such as ARIMA. These methods work very well in many cases, but they are not appropriate for capturing patterns in large quantities of data. Very recently, some deep learning techniques have been proposed as a way to build very advanced and accurate models from large quantities of time series data. ","Data Science,Deep Learning,Machine-Learning,Open-Source,Python 3",Darts: Unifying time series forecasting models from ARIMA to Deep Learning
lil anonymous,July 2021,"Our generation of young people in school (aged 5-18) have noticed the connection between Computer pRogramming, Technology, Bitcoinsm Success and Billionaires. ","Beginners,Education,EuroPython,python",Creating the Next Generation of Billionaires-Part 3
Alexys Jacob,July 2021,In this talk I will walk you through all the steps needed to create and host feature rich and localized documentations (and even websites) using MkDocs + Github Pages.,"Community,Documentation,Internationalization,Open-Source,Tooling",Create beautiful and localized documentations and websites using MkDocs + Github
Anastasiia Tymoshchuk,July 2021,Do you document your code? Do you think it is important?,"Best Practice,Python general",Continuous Documentation for your code
Kautilya Katariya,July 2021,"Online teaching materials enable learning programming at any age. Kautilya, a 7-year-old programmer who has learned his way through multiple courses in Python and Artificial Intelligence, shares his takeaways and examples so that we can learn what he has learned about Computational Complexity., In this talk, he focuses on the time complexity in computational/algorithmic complexity. As he lays out the theoretical foundations of how we formally measure how fast a program or algorithm runs, he teaches us to analyse the amount of time our program creation choices have on how much time program will take to finish.","Algorithms,Data-Structures,Education,Programming,Python 3",Computational Complexity Theoretical Foundation on How Long Will Program Run
Kirill Borisov,July 2021,"This talk will be about using Hypothesis and tools derived from it to test existing Python linters and fixers. While it is possible to test them by using hand-crafted pieces of code, sheer expression power of Python makes it very hard to think about every corner case that can be encountered. Even mature, widely-used tools like black or (gasp!) Python parser still manage to get it wrong.","Code Analysis,Compiler and Interpreters,Python 3,Python Skills,python",Code From Nothing: Procedural Generation of Python Source Code
Pierre Clisson,July 2021,"Brain-Computer Interfaces (BCIs) enable people to interact with physical devices by using their mind only. For a long time, building such systems has been the prerogative of the academic world, and has required cumbersome tools and expensive hardware. It is now time to get BCIs out of the lab and into the hands of programmers.","Data Science,Human-Machine-Interaction,Machine-Learning,Open-Source,Scientific Libraries (Numpy/Pandas/SciKit/...)",Building Brain-Computer Interfaces with Timeflux
"Shruti Mishra,Sonal Deshmukh,Gourika Sood",July 2021,"The proposed project is both a web and a mobile application. The web application makes use of the Django framework for its structure and backend. The mobile application uses Flutter, which is a cross-platform for both iOS and Android. The basis of the application would mainly be concerned as use for Educational Institutes. ,The application also projects an important feature, that is, Smart Attendance System. The proposed system keeps track of attendance using barcodes. It uses openCV to scan the barcodes. System stores student attendance details and generates a brief report for the administrator. The libraries used for the project are: openpyxl, cv2, pyzbar, xlsxwriter.","Cross-Platform-Development,Databases,Django Projects,Python 3,Web",Building Application using Flutter and Django
Julian Camilleri,July 2021,"An introduction to how to write clean code (type hinting, docstrings, inline comments et cetera) and supporting the clean code with maintainable project structure and unit tests.","Best Practice,Clean Code,TDD,Teaching","Building a clean, maintainable and tested code base"
Gajendra Deshpande,July 2021,"A recent study by CheckPoint Research has recorded over 1,50,000 cyber-attacks every week during the COVID-19 pandemic. There has been an increase of 30% in cyber-attacks compared to previous weeks. The pandemic has been the main reason for job loss and pay cuts of people and has led to an increase in cybercrimes. Examples of cyber-attacks include phishing, ransomware, fake news, fake medicine, extortion, and insider frauds. Cyber forensics is a field that deals with the investigation of digital crimes by analyzing, examining, identifying, and recovering digital evidence from electronic devices and producing them in the court of law. Python has a great collection of built-in modules for digital forensics tasks. The talk begins with an introduction to digital crimes, digital forensics, the process of investigation, and the collection of evidence. Next, I will cover the various python modules and built-in functions required to build your first cyber forensic application. The modules covered in the discussion are pyscreenshot, PIL, secrets, argparse, hashlib, os,csv, logging, time, sys, stat and NLTK. Finally, I will demonstrate using code walk through the sample cyber forensic application.","Cryptography,Data Privacy,Natural Language Processing,Security",Build Your First Cyber Forensic Application using Python
Harsh Bardhan,July 2021,"With the rise of Serverless Applications, Developers now focus on developing the Code Logic and allow their Cloud Service Provider to focus on the deployment. Serverless exactly doesn’t mean that there are no servers. It just means that we don’t need to provision and maintain them. The Cloud Service Provider takes care of packaging and deployment almost instantaneously.","APIs,DevOps general,RESTful,Web General,serverless",Build Serverless Python Applications using AWS Chalice
Thomas Y. Chen,July 2021,"Machine learning and artificial intelligence have enabled many solutions that tackle real-world problems, from climate change to autonomous vehicle development. However, with any new technology comes novel issues to address, and in the consideration of machine learning, a recurring concern is the interpretability of the models. Particularly, this refers to the ability of humans, and especially end users of the technology, to understand how the model came to its decision. One way of opening up “black box models” (algorithms that are relatively uninterpretable) that are trained on imagery (computer vision models) is to create saliency maps that are qualitative, visual representations of which parts of each image had the most influence in the deep learning model’s prediction for that image. In this talk, we discuss one interesting way of achieving this. After training a convolutional neural network (CNN) using PyTorch on an image dataset (which can be anything, such as ImageNet), we explore using the GradCam repository to create gradient-weighted class activation maps, which harness the CNN and uses the gradients of any target concept, flowing into the final convolutional layer to produce a coarse localization map highlighting important regions in the image for predicting the concept. It is recommended that attendees of this talk are familiar with at least the basics of machine learning, deep learning, and computer vision, but the presentation will not be too technical as to encourage less experienced folks.","Algorithms,Computer Vision,Deep Learning,Machine-Learning",Big Imagery Data Visualization with Gradient-weighted Class Activation Maps
"Marko Ristin,Phillip Schanely,Lauren De bruyn",July 2021,"Good programs are correct programs. Testing is an indispensable tool making sure that the software we produce is correct. The bulk of today’s Python programs are tested using unit tests, on a case-by-case basis. While unit tests are important, thorough tests are tedious to write. A lot of edge cases need to be considered and human errors easily slip in.","Code Analysis,Programming,Software Design,Testing",Automatic Testing of Python Functions Based on Contracts
Ondrej Urban,July 2021,"During my first steps in the field I was promised that machine learning would be automated from the beginning. Unfortunately, once I’ve outsourced looking for the parameters that best matched my data to the machines, I was instead left with having to look for the hyperparameters that define the best model architecture, all by myself. This often ends up being a lengthy manual process. Is there a way to outsource this bit too?","Data Science,Deep Learning,Machine-Learning",Automated Machine Learning With Keras
"Matthias Feurer,Katharina Eggensperger",July 2021,AutoML makes machine learning accessible for everyone!,"Data Science,Machine-Learning,Science,Scientific Libraries (Numpy/Pandas/SciKit/...)",Auto-Sklearn: Automated Machine Learning in Python
Koketso Motse,July 2021,"This talk will cover:,Game development in python,Game design in python,Competitive gaming and esports","Beginners,Game-Development,Python 3",All things esports and competitive gaming and game development in Python
Rabeea Emad,July 2021,"FastAPI is one of the fastest growing Python web frameworks – in part due to its ease of usage and high performance. In this talk, I will teach you how you can rapidly process European covid vaccine popularity data using Fire, place it into Azure Database for Postgres (for free!) and then leverage FastAPI  to serve them through a back-end. Finally, I will launch the backend online through Azure App Service and use Jupyter to visualize the data from the API to answer interesting questions! Come join me and let the adventure begin!","Public Cloud,Web,python","Analyzing COVID Vaccine Popularity in Europe Using FastAPI, Postgres & Azure"
Markus Holtermann,July 2021,"Every other job opening for an IT position mentions Kubernetes. But unless you’ve worked with Kubernetes or seen it in action, you probably only have a vague idea of what it is, what it does and can do, or how to use it. And that’s understandable. It’s this big, abstract, software, that is supposed to “solve all the problems”. In this talk I’ll go through some of the concepts Kubernetes has. We’ll approach these by deploying a Django application, with the intent, that next time somebody asks you, “Do you know Kubernetes?”, you can confidently answer “Yes!”.","DevOps general,Infrastructure,Operations",An Introduction to Kubernetes ☸️
Christoph Dr. Zimmermann,July 2021,"The presentation introduces RedisGears, a novel approach to Python programming on the server side of an open source real-time NoSQL database. ,Ten years in the making, redis has achieved a significant following among the community concerned with ultra-fast processing of NoSQL-based data. ,With the advent of modules a few years back, redis can be further extended to bridge the gap between the comprehensive set of data structures already offered by the server core and application-specific requirements such as graphs, timeseries data or full-text search capabilities. RedisGears is such a module. At its core, it offers a flexible infrastructure allowing the combination of different modules in addition to scheduling, mapping, filtering and other functionality to process data on the server side. In addition, it allows the execution of Python code on server side, yielding an ultra-performant and flexible approach to the implementation of business logic as part of an application code base. ","APIs,NoSQL,Python 3,The Answer to Life the Universe and Everything Else",Adventures in Real-time Python NoSQL-style
Vinayak Mehta,July 2021,"Have you ever wondered why Python is referred to as CPython and what is the Python C-API everyone keeps talking about? Come to this talk and find out! We'll briefly take a look at the C-API, how we can use it to extend Python's functionality, and how we can write Python C extensions using pybind11.","CPython,Development,Packaging,PyPi,Tooling",A Tale Of Python C Extensions And Cross-Platform Wheels
Scott Irwin,July 2021,A Hitchhiker’s Guide to functools,Functional Programming,A Hitchhiker’s Guide to functools
Eyal Kazin,July 2021,"Correlation does not imply causation. It turns out, however, that with some simple ingenious tricks one can unveil causal relationships within standard observational data, without having to resort to expensive random control trials. ","Analytics,Data Science",A Gentle Introduction To Causal Inference
Miki Lombardi,July 2021,In March 2020 the world is completely blocked and people are lining up to shop or to the pharmacy or to buy basic necessities.,"Analytics,Case Study,Data,Development,HTTP",A crowdsourced map for checking supermarket wait times worldwide
Joannah Nanjekye,July 2021,"Python is great but it definitely has faults too. In this talk, I will talk about some of the Python challenges as a language, and the current efforts in the community to alleviate them. I will also talk about how I plan to engage scientists and academics during my time on the PSF board, to highlight some of the research we are working on as a community.","Community,python",Python the Bad Parts
Abigail Dogbe,July 2021,"The use of Python in Africa is widely spread daily. In this talk, I will take you on a journey of what Python means to us in a Pan-African setting, lessons learned from organizing PyCon Africa, the people behind it, challenges we are facing and reflections on what works in our ecosystem.","Community,Conferences and Meet-Ups,python",Python in a world of Pan-Africanism
Kimberly Arcand,July 2021,"Information of our Universe doesn't have to be just a two-dimensional snap shot. We can transform these data to be able to listen, feel, or (virtually) move through cosmic objects.  Listen to the debris from an exploded star, walk through the core of our Milky Way in virtual reality, feel vibrations of a stellar nursery, and experience our universe anew.","Natural Science,Science,Visualization","Our Universe through Sight, Sound & Touch"
Pablo Galindo Salgado,July 2021,"In this talk I will go into some interesting stories of how (C)Python is made. We will go through a journey that will show you how Python is developed, who works on it, interesting battles against the most obscure of bugs and lots of unexpected situations and things to learn and to reflect on.","CPython,python",Nobody expects the Spanish inquisition
David Beazley,July 2021,"While biking through the forest preserve on a dark December morning, I found myself suddenly staring face-to-face with Bambi.  Picking myself off the ground with a broken wrist and an assortment of broken fingers, I embarked on an unexpected journey of discovery.   Then the pandemic hit.   In this talk, I provide a trip report.",math,"No, not typing. Types."
