author,date,description,tags,title
Andy Fundinger,July 2021,"Many of the systems we build fail to account for performance, error rates, data correctness, or other customer reliability needs. This talk discusses the basics of service level objectives by comparing them to ordinary functional specifications. It also serves as an introduction to System Reliability Engineering (SRE).","Best Practice,Engineering",The spec you never knew you needed
Marc-Andre Lemburg,July 2021,"Python has come a long way since it was created in 1989. The talk will look into the current state, upcoming changes and explore possibilities for its future development, both at a language and application level.","Business,Development,Engineering,New Features,Python general",Thoughts on the Future of Python
Tarik Berrada,July 2021,"Your parents haven’t talked to each other for years. Your uncle Sam went to the same university as Mr. Finkelstein, while the Trautsohns share a common interest for photography with the Krazinskis. The N’Guyens had Covid, while the Lefebvres aren’t even vaccinated. You would like to achieve a reasonable mix of people knowing each other and of new acquaintances. How are you supposed to arrange the seating of the guests?","Science,python",The Optimal Wedding (With Pyomo)
Luke Leighton,July 2021,"The Libre-SOC Project aims to bring to market a mass-volume System-on-a-Chip suitable for use in smartphones netbooks tablets and chromebooks, which is end-user programmable right to the bedrock. No spying backdoors, no treacherous DRM.","3D,Compiler and Interpreters,Mind Bending,Other Hardware,The Answer to Life the Universe and Everything Else",The Libre-SOC Project
Stefanie Stoppel,July 2021,"Imagine you're a Black woman having your face not recognized by a government photo booth, no matter how you position yourself in front of the camera.,Imagine you're a woman getting your loan request rejected, while your partner - who has a similar income and credit history - gets his approved.,Imagine you're an African American man arrested by the police because your face was mistakenly matched to a guy involved in an armed robbery.","Data,Data Science,Deep Learning,Ethics,Machine-Learning",The Myth of Neutrality: How AI is widening social divides
"Alexys Jacob,Sébastien Crocquevieille,Romain Meson,Margaux Levisalles,Brieuc Le Bars",July 2021,"Through its 1000mercis Impacts initiative, Numberly has been actively working with tech and non tech associations over the years for social, environmental and educational causes. ",Community,Tech for Good: Build the world you want to live in
Haki Benita,July 2021,"There are many sources of nondeterminism in code such as randomness, IO, environment variables, databases and many more. Nondeterminism is a source of confusion, and it makes testing difficult. One way to control nondeterminism is using the dependency injection pattern.","Development,Programming,Software Design,Testing",Taming Nondeterminism with Dependency Injection
Ruud van der Ham,July 2021,"Even if you use a debugger, it is often required to print some variables or expressions, preferably with their name and sometimes even the location. ,The normal way to do that is with a print statement, like,|    print(""hello= "", hello),or with Python >= 3.8:,|    print(f""hello=""),Ycecream makes this easier with a simple call to y:,|   y(hello),and then you will get,|   y| hello: ""world"",But you can also add the location in the program where this debug call is coming and get something like,|    y| #6 in testproc() hello: ""world""","Debugging,General,Performance,Python general,Tooling",Sweeter debugging and benchmarking with ycecream
Steven Kolawole,July 2021,"When we think about building Python-based data science apps, we think of Flask. But there is a better option now. Streamlit.","Data Science,Machine-Learning,Natural Language Processing,Python 3,Visualization",Streamlit: The Fastest Way to build Data Apps
Zac Hatfield Dodds,July 2021,"We often think of manual testing as slower and less effective than automated testing, but most test suites haven't automated that much! Computers can execute all our pre-defined tests very quickly - and this is definitely a good thing, especially for regression tests - but the tricky parts are still done by humans. We select test cases (inputs) and check that the corresponding outputs make sense; we write functions that ""arrange, act, and assert"" for our tests; and we decide - or script via CI systems - which tests to execute and when. So lets explore some next-generation tools that we could use to automate these remaining parts of a testing workflow!","Best Practice,TDD,Test Libraries (pytest/nose/...),Testing,Tooling",Stop Writing Tests!
María Andrea Vignau,July 2021,"Outline,Introduction: advantages, best and worst use cases.,Why this little database is amazing and where it can be used at its best.,SQLite & Python: best practices,Use of context managers, row factories, executing many operations at once and the concept of PRAGMAs,Transactions, isolation and concurrency,Transactions management in SQLite, use of WAL, Rollback and no journaling modes. Isolation levels: exclusive, immediate and deferred,Indexing,Why and why not indexing. Partial index, expression index, FTS index.,Special data types,Date & Time data, personalized data types","Algorithms,Best Practice,Databases,Python general","SQLite, an (un) known super ant"
Marc Päpper,July 2021,"An important, but often overlooked aspect of developing a high-quality deep learning model is the iteration speed.,If you can iterate faster, you can try out more ideas and over time you get better results.,In this talk, you will learn about the different tricks you can use to train a great machine learning model in a shorter amount of time.,In particular, I will discuss how we optimized our deep learning development life cycle at Mindpeak to create robust deep learning models for cancer diagnostics that work in vastly different laboratory settings.","Computer Vision,Deep Learning,Development,GPU,Machine-Learning",Speeding up the deep learning development life cycle for cancer diagnostics
Jon Nordby,July 2021,"Sound Events (or Audio Events or Acoustic Events) are individual distinct sounds.,This could be the pop of roasting popcorn kernels,,the cough of a patient, a car that is passing by on a road,,or the sound of an alarm in an office building.,Sound Event Detection (SED) is the task of detecting such sounds,,returning precise times that each kind (class) of sound occurs.,It finds uses in music analysis, manufacturing, medicine and noise monitoring.","Data,Data Science,Machine-Learning,Sensors",Sound Event Detection with Machine Learning
Sam Thursfield,July 2021,Can simple open source tools compete with the music recommendations provided by Spotify and other big names?,Algorithms,"Simple, open, music recommendations"
Alon Nir,July 2021,"What would the world look like if Russia won the cold war? If the Boston Tea Party never happened? And where would we be if Guido van Rossum had decided to go to music school? Unfortunately we don't have the technology to slide into parallel worlds and explore alternative histories. However it turns out we *do* have the tools to simulate parallel realities and give decent answers to intriguing 'what if' questions. This talk will provide a gentle introduction to these tools, professionally known as Causal Inference.","Data Science,Predictions,Science,The Answer to Life the Universe and Everything Else,Tooling","Sliding into Causal Inference, with Python!"
Miroslav Šedivý,July 2021,"Migration to Python 3 is over, but that's not the end of the journey. Although your code runs with the currently supported Python 3.6 to 3.9, there may be some pieces of code that look obvious to you, but may surprise younger developers who have never seen Python 2 code.","Clean Code,Development,New Features,Python 2,Python 3",Should We Return to Python 2?
Irina Grechikhina,July 2021,"Sentry is an open-source error tracking software. It allows you to know exactly what's going on with your web application in real-time and get detailed reports about occurred errors. Lot's of web developers used to rely only on app logs and generic monitoring software, but it's not enough. Multiple production servers, overwhelmed logging, lack of information about request content in case of error hinders problem investigation and produces permanent developer fear of changes. Sentry could ease the whole process and make you: stay calm during deployment, be sure your application works properly, solve problems before users report about it.","Debugging,Development,HTTP,Web",Sentry as a way not to be afraid
Lim H.,July 2021,"Data scientists, data engineers and machine-learning engineers often have to team together to create data science code that scales. Data scientists typically prefer rapid iteration, which can cause friction if their engineering colleagues prefer observability and reliability. ","Data,Data Science,Development",Reproducible and Deployable Data Science with Open-Source Python
Sebastian Buczyński,July 2021,"Every year we can hear rumours about the demise of Object-Oriented Programming. As usual, they are greatly exaggerated. In 2021 OOP still has a lot to offer. The problem is a shortage of good quality materials that would show where it shines and how a Pythonista can leverage it without writing code that looks like Java from the 00s.","Clean Code,TDD,legacy-code",Refactoring legacy Django app using OOP
Sebastian Witowski,July 2021,"Managing Python versions and dependencies can be painful. JavaScript developers have their ""node_modules"" folders, but we don't have ""python_modules"" (yet!) in Python. Instead, we have those mysterious virtual environments. And if you also want to switch between different Python versions, it can quickly turn into a mess.","Development,Tooling,Virtual Env",Python Versions and Dependencies Made Easy
Michał Wodyński,July 2021,"Have you ever have a feeling that you are able to write code that solves problem but your not sure whether is safe? How much of your time you spend on investigating whether your code is not vulnerable ? Do you know what kind of risks you can face during parsing XML files? If those questions appeared into your mind this presentation will clarify your doubts and bring your skills closer to writing more safe code. There are many repeatable routines during developing code like: saving user data, reading files or pickles. Those routines can lead to a drop in vigilance which may lead to very terrible consequences for our application or data.","Best Practice,Programming,Python 3,Security,Tooling",Python security best practises
Or Weis,July 2021,"Modern distributed software doesn't stop at your VPC. Edge deployed software needs realtime communications, updates, and state sync. It needs RPC and PubSub over the web. Lets make it open-source.","APIs,ASYNC / Concurreny,Communication,Distributed Systems,Web Servers and MicroFWs (Flask/Tornado/Nginx/...)",Python RPC and PubSub over Websockets
Benjy Weinberger,July 2021,"As organizations and repos grow, we have to choose how to manage codebases in a scalable way. We have two architectural alternatives:","Architecture,Best Practice,Clean Code,Development,Engineering","Python monorepos: what, why and how"
"Sid Unnithan,Claudia Regio",July 2021,Learn how Native Notebooks in VS Code can supercharge your data science workflow and how to follow up your deployment of machine learning models using the Azure Machine Learning service!,"Data Science,Machine-Learning,python",Python Data Science with VS Code and Azure
Vinicius Gubiani Ferreira,July 2021,Most people heard at least once or focused really hard on studying design patterns. But did you know there are also lots of anti-patterns we should try to avoid?,"Best Practice,Clean Code,Python general,Software Design,python",Python Anti-Patterns
Rodrigo Girão Serrão,July 2021,"EDIT: Talk slides available at ,; you can reach out to me with comments/questions on Twitter @mathsppblog or through email at rodrigo at mathspp dot com.","Abstractions,Best Practice,Clean Code,Python Skills,Python general",Pydon'ts
Utkarsh Mishra,July 2021,"A photo is an image that represents an external form of a person or a thing from the past. It communicates any past incident or activity to the present or future, reminding them of the melodious memories they have.","APIs,Computer Vision,Deep Learning,Image Processing,Machine-Learning",Python and Flutter application for Colouring and Enhancing Old Photos
James Nightingale,July 2021,"A major trend in data science is the rapid adoption of Bayesian statistics for data analysis and modeling. With modern data-sets growing by orders of magnitude in size, the focus is now on developing methods capable of applying contemporary inference techniques to extremely large datasets. To this aim, I present PyAutoFit (,), an open-source probabilistic programming language for automated Bayesian inference that was recently published in the Journal of Open Source Software (,).","Big Data,Data Science,Open-Source,Science",PyAutoFit: A Classy Probabilistic Programming Language For Data Science
Oliver Cobb,July 2021,"Deployed machine learning models can fail spectacularly in response to seemingly benign changes to the underlying process being modelled. Concerningly, when labels are not available, as is often the case in deployment settings, this failure can occur silently and go unnoticed.","Beginners,Data Science,Deep Learning,Machine-Learning,failures/mistakes",Protecting Your Machine Learning Against Drift: An Introduction
Alejandro Saucedo,July 2021,# Session Description,"Best Practice,Data Science,DevOps general,Machine-Learning,Scientific Libraries (Numpy/Pandas/SciKit/...)","Production ML Monitoring: Outliers, Drift, Explainers & Statistical Performance"
Sylvain Marié,July 2021,"`pytest` is undoubtedly the most popular test framework for python. Its fixture and parametrization mechanisms, as well as its detailed hook API and vibrant plugin ecosystem make it a must-know for any developer wishing to create quality software. Some key limitations in its engine and API, however, prevent users from truly unleashing their testing scenarii. Creating tests with complex parametrization is complicated, and users trying to explore this direction may loose the legendary elegance and maintainability of pytest tests on the way.","Data,Data Science,Science,Test Libraries (pytest/nose/...),Testing",Powerful tests and reproducible benchmarks with `pytest-cases`
Eli Holderness,July 2021,"Ever wondered about the difference between `is` and `==`, or why you might need to use `deepcopy`? Maybe you’ve been stumped by an interview question about object lifetimes, or overriding the `__eq__` method. Or, perhaps, you just really want to see some tuples behaving badly. ","Abstractions,Beginners,CPython,Compiler and Interpreters,Python general",Pointers? In my Python? It's more likely than you think
Yashasvi Misra,July 2021,"I owe both my personal and professional growth to communities. As an engineering student in computer science, the first open tech community I joined was PyLadies. I have since then been actively involved in the Python community, always trying to learn and grow. Little did I expect how beneficial that would be. In this session, I will share my journey with the Python community, the impact it had on me, and how it boosted my self-confidence. If you don’t know where to start, join me to explore what I have learned so far.","Beginners,Community,Diversity,PyLadies,python",Personal growth and the Python community
Daniel Moisset,July 2021,"When Python 3.10 comes out in October 2021, it will include a new feature called “Structural Pattern Matching”. Structural Pattern Matching has been a staple of functional programming languages, but it has recently appeared or been proposed as future additions to imperative and OOP programming languages (like JavaScript, C++, and Rust). It provides an elegant way of processing and deconstructing heterogeneous data structures, and it enables an alternative paradigm to method dispatch.","CPython,Functional Programming,New Features,Python general",Pattern Matching in Python
David Bordeynik,July 2021,"FastAPI is the new kid on python’s web frameworks block.,Don’t let its novelty fool you - it is feature packed and it has top notch documentation.,In this talk, we’ll build an application using FastAPI - leveraging our knowledge from existing frameworks. We’ll see how the “fast” FastAPI is for fast development.","APIs,ASYNC / Concurreny,Best Practice,Development,Web",Moving Fast with FastAPI
Itamar Turner-Trauring,July 2021,"If your program is using too much memory, it can crash, thrash, or just run more slowly. To reduce memory usage, you need to measure it somehow.","Data,Debugging,Performance",Measuring memory: Python memory profilers and when to use them
Nabanita Roy,July 2021,"Wikipedia is the digital encyclopedia that we use daily to find out facts and information. What could be better than being able to extract the extreme wealth of crowd-sourced knowledge from Wikipedia without using traditional web scrapers? Various community-driven projects extract knowledge from Wikipedia and stores them structurally, retrievable using SPARQL. It can be used to mine data for a range of Data Science projects. In this talk, I will walk through the basics of the Open Web and how to use Python to use this huge open database.,The agenda includes the following:,•	Why Wikipedia?,•      Introduction to DBpedia and Wikidata,•      Introduction to Linked Data,•      How to query DBpedia/WikiData,      o	Build SPARQL Query,      o	Use Python’s SPARQLWrapper,•	Python Code Walkthrough to create,      o	A Tabular Dataset using SPARQL,      o	A Corpus for Language Models using Wikipedia and BeautifulSoup,      o	An Use-Case leveraging both SPARQLWrapper and Wikipedia to Create Domain-Specific Corpus ","Case Study,Data Science,Databases,Natural Language Processing,Web",Leveraging Linked Data using Python and SPARQL
Matteo Bertucci,July 2021,This talk is divided in two parts: the first one will explore how the Git key-value storage work and the second part will walk through recreating the fundamental `git commit` command with less than 80 lines of Python.,"Beginners,Best Practice,Case Study,Command-Line,Git",Learn Python automation by recreating Git Commit from scratch
Joel Christiansen,July 2021,"Python packaging has come a long way since the days of easy_install and eggs. With the advent of wheels, and more recently pyproject.toml and PEPs 518, 517, and 621, the future looks bright for the world of python build tool. I will briefly explore the history of python packaging, and look at how we can take advantage of these developments to increase reliability and safety in python build tools.","Best Practice,Packaging,python",Managing transient dependencies
Kir Chou,July 2021,"Detailed description,In late 2019, Guido van Rossum wrote a series of articles about PEG parser and gave the talk ""Writing a PEG parser for fun and profit"" in a couple of conferences, such as North Bay Python, mentioned the motivation of his research and prototype of PEG parser. In late 2020, other authors of PEP 617, Pablo Galindo and Lysandros Nikolaou, (created around mid of 2020) were interviewed on Podcast.__init__ to talk about the result of the new PEG parser in CPython.,Above contents assume the audience with solid compiler fundamental knowledge, but the fact is most People, including this talk's speaker, are not specialized in compiler. And another fact is most of the compiler class in school around the world only covers traditional top-down and bottom-up parsing techniques, not to mention PEG parser that appeared in the early 2000s.,For the above reasons, the speaker will stand on the shoulders of giants and share his hard way after a few months of study. He will talk about the fundamentals of Parser (part of compiler frontend), including CFG, traditional parsing techniques, PEG, Packrat parser, and PEG parser in CPython.","CPython,Compiler and Interpreters,Python 3",Learn from LL(1) to PEG parser the hard way
Cristián Maureira-Fredes,July 2021,"One of the main reasons that stop people to write Python C extensions                               ,and even attempt to contribute to CPython is due to the fact that                                   ,you need to know another programming language, C.                                                   ,                                                                                                                                                                                                                                             ,Wait, don't go! don't be scared by the fact that you will hear                                      ,about C, this talks objective is not that! but only to learn                                        ,the essential bits to get more comfortable around CPython.                                          ,                                                                                                    ,By understanding the internals, you will feel like the same as that time                            ,in your childhood when you took something apart, then re-assemble it                                ,again and it worked (if that was not the case, this will be your first time                         ,I promise).                                                                                         ,                                                                                                    ,During this talk, you will go on a journey to understand how Python works,                          ,and which are the places you can look to understand the implementation of                           ,different Python details, from the whole interpretation process, until                              ,look what's lies under the module/types functions you use everyday.                                 ,You will get the power to add new functionality to Python and even how to                           ,create your first C-based extension module.                                                         ,                                                                                                    ,If you are not familiar with C, don't worry, I will guide you every time                            ,some C code is shown, and if you know some C, then you will be able                                 ,to sit back and relax during this ride.","C-Languages,CPython,Compiler and Interpreters,Data Structures,Fun and Humor",Learn CPython by breaking it
Abhilash Majumder,July 2021,"Introduction to Quantum Deep Learning,Abstract,The aim of the lightning talk is to shed light into the field of Quantum computation in the field of Deep Learning. Qubits , which form the fundamental units of quantum computing can be used to create quantum variational circuits which can be placed over traditional deep learning networks to create hybrid quantum-deep learning models. These models not only rely on the gradient convergence properties of general backpropagation technique, but also on the final probabilistic states of the Qubits. Essentially there has been quite a development to optimize the gradient convergence of these hybrid models with the help of Fischer approximation and Natural Gradient Descent.The talk would focus on the importance of Quantum Variational Deep Learning Circuits and how they provide an advantage over traditional Autograd based Circuits. The application of Quantum Variational circuits in the field of Reinforcement Learning as well as NLP would be one of the main points of the talk. There has been sufficient development in the field of quantum computing and this talk aims to throw light on how to exploit the probabilistic states of Qubits to enhance deep learning models.","Deep Learning,Generative Adversarial Networks,Machine-Learning,Natural Language Processing,python",Introduction to Quantum Deep Learning
Sebastiaan Zeeff,July 2021,"With the increasing popularity of asynchronous frameworks, such as FastAPI, communicating asychronously with databases has become a hot topic in Python development. While there were already a lot of database drivers with asynchronous support available, support for asynchio in Object-Relation Mapping (ORM) frameworks was a lot rarer. That is, until the release of version 1.4 of SQLAlchemy back in March of 2021, which added support for Asynchronous I/O to one of the most popular ORM frameworks for Python.","ASYNC / Concurreny,Databases,Python 3,SQL Alchemy,Tooling",Introducing Asynchronous SQLAlchemy
Ben Nuttall,July 2021,"In BBC News Labs, we're always looking for ways to innovate without requiring production teams to change their workflows. We investigated ways we could enrich our digital output by extracting detailed information about the contents of our TV and radio programmes from their running orders.","Abstractions,Open-Source,Public Cloud,python",Innovation in the newsroom
